,course,rating,students,level,university,skills
0,Python for Everybody,4.8,"2,7 m",Beginner,University of Michigan,Python
1,Google IT Automation with Python,4.7,600 mil,Beginner,Google,Python
2,Python 3 Programming,4.7,350 mil,Beginner,University of Michigan,Python
3,Crash Course on Python,4.8,520 mil,Beginner,Google,Python
4,Data Science Fundamentals with Python and SQL,4.6,570 mil,Beginner,IBM,Python
5,Applied Data Science with Python,4.5,800 mil,Intermediate,University of Michigan,Python
6,Programming for Everybody (Getting Started with Python),4.8,"2,5 m",Mixed,University of Michigan,Python
7,"Python for Data Science, AI & Development",4.6,380 mil,Beginner,IBM,Python
8,IBM Data Science,4.6,1 m,Beginner,IBM,Python
9,Introduction to Programming with Python and Java,4.4,35 mil,Beginner,University of Pennsylvania,Python
10,IBM DevOps and Software Engineering,4.6,470 mil,Beginner,IBM,Python
11,Bachelor of Science in Computer Science,None,None,None,University of London,Python
12,Программирование на Python,4.5,80 mil,Intermediate,Moscow Institute of Physics and Technology,Python
13,Python Basics,4.8,300 mil,Beginner,University of Michigan,Python
14,Statistics with Python,4.6,110 mil,Beginner,University of Michigan,Python
15,Data Structures and Algorithms,4.6,550 mil,Intermediate,University of California San Diego,Python
16,Master of Science in Data Science,None,None,None,University of Colorado Boulder,Python
17,Introduction to Scripting in Python,4.7,110 mil,Beginner,Rice University,Python
18,IBM Data Analyst,4.6,720 mil,Beginner,IBM,Python
19,Data Science Foundations: Data Structures and Algorithms,4.6,12 mil,Advanced,University of Colorado Boulder,Python
20,Django for Everybody,4.7,73 mil,Intermediate,University of Michigan,Python
21,Python for Data Analysis: Pandas & NumPy,4.4,"3,9 mil",Beginner,Coursera Project Network,Python
22,Master of Science in Machine Learning and Data Science,None,None,None,Imperial College London,Python
23,Python and Statistics for Financial Analysis,4.4,120 mil,Intermediate,The Hong Kong University of Science and Technology,Python
24,Python for Cybersecurity,4.4,"6,5 mil",Intermediate,Infosec,Python
25,Python Scripting for DevOps,4.2,"3,4 mil",Beginner,LearnQuest,Python
26,Introduction to Python Programming,4.4,24 mil,Beginner,University of Pennsylvania,Python
27,Master of Computer and Information Technology,None,None,None,University of Pennsylvania,Python
28,Introduction to Python,4.5,29 mil,Beginner,Coursera Project Network,Python
29,Data Science for Investment Professionals,4.9,"1,5 mil",Beginner,CFA Institute,Python
30,Advanced Data Science with IBM,4.3,110 mil,Advanced,IBM,Python
31,Introducción a la programación en Python I: Aprendiendo a programar con Python,4.4,200 mil,Beginner,Pontificia Universidad Católica de Chile,Python
32,IBM AI Engineering,4.6,300 mil,Intermediate,IBM,Python
33,Learn to Program: The Fundamentals,4.7,280 mil,Beginner,University of Toronto,Python
34,Modern Application Development with Python on AWS,4.7,140 mil,Beginner,Amazon Web Services,Python
35,Programming in Python: A Hands-on Introduction,4.5,"5,2 mil",Beginner,Codio,Python
36,Python Data Products for Predictive Analytics,4.2,25 mil,Intermediate,University of California San Diego,Python
37,Python Data Structures,4.9,830 mil,Mixed,University of Michigan,Python
38,Introdução à Ciência da Computação com Python Parte 1,4.9,190 mil,Beginner,Universidade de São Paulo,Python
39,Programación en Python,4.7,12 mil,Beginner,Universidad de los Andes,Python
40,Investment Management with Python and Machine Learning,4.6,52 mil,Beginner,EDHEC Business School,Python
41,Advanced Machine Learning,4.4,350 mil,Advanced,HSE University,Python
42,IBM Data Engineering,4.6,500 mil,Beginner,IBM,Python
43,Facebook Marketing Analytics,4.7,16 mil,Beginner,Meta,Python
44,Machine Learning,4.9,"4,7 m",Mixed,Stanford University,Python
45,Python Classes and Inheritance,4.7,75 mil,Intermediate,University of Michigan,Python
46,DeepLearning.AI TensorFlow Developer,4.7,330 mil,Intermediate,DeepLearning.AI,Python
47,Python Data Structures,4.4,"8,4 mil",Intermediate,Coursera Project Network,Python
48,Databases and SQL for Data Science with Python,4.6,240 mil,Beginner,IBM,Python
49,Python Project for Data Science,4.5,54 mil,Intermediate,IBM,Python
50,Data Analysis with Python,4.7,230 mil,Beginner,IBM,Python
51,Using Python to Access Web Data,4.8,550 mil,Mixed,University of Michigan,Python
52,Introduction to Data Science in Python,4.5,660 mil,Intermediate,University of Michigan,Python
53,Using Python to Interact with the Operating System,4.7,130 mil,Beginner,Google,Python
54,Data Visualization with Python,4.5,150 mil,Intermediate,IBM,Python
55,Fundamentos de Ciencia de Datos con Python y SQL,4.3,"4,6 mil",Beginner,IBM,Python
56,Introduction to Portfolio Construction and Analysis with Python,4.8,44 mil,Mixed,EDHEC Business School,Python
57,Using Databases with Python,4.8,410 mil,Mixed,University of Michigan,Python
58,Aprende a programar con Python,4.5,49 mil,Beginner,Universidad Austral,Python
59,Foundations of Data Science: K-Means Clustering in Python,4.7,27 mil,Beginner,University of London,Python
60,Understanding and Visualizing Data with Python,4.7,97 mil,Beginner,University of Michigan,Python
61,Data Analysis Using Python,4.6,"7,5 mil",Beginner,University of Pennsylvania,Python
62,Python for Genomic Data Science,4.3,46 mil,Mixed,Johns Hopkins University,Python
63,用 Python 做商管程式設計（一）(Programming for Business Computing in Python (1)),4.9,27 mil,Beginner,National Taiwan University,Python
64,Python Project for Data Engineering,4.6,"9,3 mil",Intermediate,IBM,Python
65,"Capstone: Retrieving, Processing, and Visualizing Data with Python",4.7,220 mil,Mixed,University of Michigan,Python
66,Exploratory Data Analysis With Python and Pandas,4.6,"7,6 mil",Beginner,Coursera Project Network,Python
67,"Python Functions, Files, and Dictionaries",4.8,85 mil,Beginner,University of Michigan,Python
68,COVID19 Data Analysis Using Python,4.5,28 mil,Intermediate,Coursera Project Network,Python
69,Create Your First Web App with Python and Flask,4.5,13 mil,Intermediate,Coursera Project Network,Python
70,Design Computing: 3D Modeling in Rhinoceros with Python/Rhinoscript,5,"8,5 mil",Mixed,University of Michigan,Python
71,Inferential Statistical Analysis with Python,4.6,32 mil,Intermediate,University of Michigan,Python
72,Practical Python for AI Coding 1,4.7,"1,9 mil",Beginner,Korea Advanced Institute of Science and Technology(KAIST),Python
73,Python Programming Essentials,4.8,75 mil,Beginner,Rice University,Python
74,Introducción a la programación con Python,4.6,39 mil,Beginner,Universidad Austral,Python
75,Create a Boggle Word Solver using recursion in Python,4.4,"2,8 mil",Intermediate,Coursera Project Network,Python
76,Applied Machine Learning in Python,4.6,250 mil,Intermediate,University of Michigan,Python
77,"Applied Plotting, Charting & Data Representation in Python",4.5,160 mil,Intermediate,University of Michigan,Python
78,Data Collection and Processing with Python,4.7,62 mil,Intermediate,University of Michigan,Python
79,Game Theory with Python,4.3,"6,6 mil",Intermediate,Coursera Project Network,Python
80,Advanced Portfolio Construction and Analysis with Python,4.8,15 mil,Intermediate,EDHEC Business School,Python
81,用Python玩转数据 Data Processing Using Python,4.7,84 mil,Mixed,Nanjing University,Python
82,Data Processing Using Python,4.1,56 mil,Beginner,Nanjing University,Python
83,COVID19 Data Visualization Using Python,4.6,"3,3 mil",Intermediate,Coursera Project Network,Python
84,Build a Data Science Web App with Streamlit and Python,4.6,14 mil,Intermediate,Coursera Project Network,Python
85,Python and Machine Learning for Asset Management,3.1,13 mil,Intermediate,EDHEC Business School,Python
86,Robot Localization with Python and Particle Filters,4.4,None,Advanced,Coursera Project Network,Python
87,"Problem Solving, Python Programming, and Video Games",4.2,36 mil,Beginner,University of Alberta,Python
88,Python Data Representations,4.7,21 mil,Beginner,Rice University,Python
89,An Introduction to Interactive Programming in Python (Part 1),4.8,200 mil,Mixed,Rice University,Python
90,"Python Project: pillow, tesseract, and opencv",4,53 mil,Intermediate,University of Michigan,Python
91,Sentimental Analysis on COVID-19 Tweets using python,4.6,None,Intermediate,Coursera Project Network,Python
92,Introduction to Python for Cybersecurity,4.4,"6,1 mil",Intermediate,Infosec,Python
93,Automating Real-World Tasks with Python,4.8,46 mil,Beginner,Google,Python
94,Python Data Analysis,4.7,33 mil,Beginner,Rice University,Python
95,Create Your First Chatbot with Rasa and Python,4.5,17 mil,Beginner,Coursera Project Network,Python
96,Build a Machine Learning Web App with Streamlit and Python,4.7,"9,9 mil",Intermediate,Coursera Project Network,Python
97,Create Interactive Dashboards with Streamlit and Python,4.7,"8,5 mil",Intermediate,Coursera Project Network,Python
98,Python para Data Science y AI,4.8,"2,1 mil",Beginner,IBM,Python
99,Create an interactive fiction adventure game with Python,4.6,3 mil,Beginner,Coursera Project Network,Python
100,Using SAS Viya REST APIs with Python and R,4.6,"3,1 mil",Mixed,SAS,Python
101,"Concepts in Python: Loops, Functions and Returns",4.7,"2,6 mil",Beginner,Coursera Project Network,Python
102,Introduction to Customer Segmentation in Python,4.6,None,Beginner,Coursera Project Network,Python
103,The Raspberry Pi Platform and Python Programming for the Raspberry Pi,4.7,110 mil,Mixed,"University of California, Irvine",Python
104,Advanced Python Scripting for Cybersecurity,4,None,Beginner,Infosec,Python
105,Introduction to Python Scripting for DevOps,4.3,"2,5 mil",Beginner,LearnQuest,Python
106,用 Python 做商管程式設計（二）(Programming for Business Computing in Python (2)),4.6,"7,9 mil",Intermediate,National Taiwan University,Python
107,Logistic Regression with Python and Numpy,4.5,"5,7 mil",Intermediate,Coursera Project Network,Python
108,Linear Regression with NumPy and Python,4.4,16 mil,Intermediate,Coursera Project Network,Python
109,Python for Finance: Beta and Capital Asset Pricing Model,4.6,None,Beginner,Coursera Project Network,Python
110,Accounting Data Analytics with Python,4.1,"8,6 mil",Intermediate,University of Illinois at Urbana-Champaign,Python
111,Image Denoising Using AutoEncoders in Keras and Python,4.5,"6,6 mil",Intermediate,Coursera Project Network,Python
112,Create a Python Application using MySQL,4.5,5 mil,Intermediate,Coursera Project Network,Python
113,Python for Data Visualization: Matplotlib & Seaborn,4.7,None,Beginner,Coursera Project Network,Python
114,Introduction to Data Science and scikit-learn in Python,3.8,None,Beginner,LearnQuest,Python
115,Create Your First Game with Python,4.5,12 mil,Intermediate,Coursera Project Network,Python
116,Creating a Wordcloud using NLP and TF-IDF in Python,None,None,Beginner,Coursera Project Network,Python
117,Exception Handling in Python,4.7,2 mil,Intermediate,Coursera Project Network,Python
118,Crime Zone Heatmaps with Python and Folium,None,None,Beginner,Coursera Project Network,Python
119,FIFA20 Data Exploration using Python,4.6,"1,9 mil",Beginner,Coursera Project Network,Python
120,Processing Data with Python,4.4,"5,7 mil",Intermediate,Coursera Project Network,Python
121,"Python Scripting: Dates, Classes and Collections",4.4,None,Beginner,LearnQuest,Python
122,GUI programming: Create a Calculator in Python,4.8,None,Intermediate,Coursera Project Network,Python
123,Neural Network Visualizer Web App with Python,4.5,"6,5 mil",Intermediate,Coursera Project Network,Python
124,Clustering Geolocation Data Intelligently in Python,4.5,10 mil,Intermediate,Coursera Project Network,Python
125,Basic Statistics in Python (ANOVA),4.4,None,Beginner,Coursera Project Network,Python
126,Build a Bot in Python for Basic File and Interface Chores,None,None,Intermediate,Coursera Project Network,Python
127,Support Vector Machine Classification in Python,4.4,6 mil,Intermediate,Coursera Project Network,Python
128,Version Control of a Python Project using Git,4.4,"1,8 mil",Intermediate,Coursera Project Network,Python
129,"Merge, Sort and Filter Data in Python Pandas",4.5,"3,4 mil",Intermediate,Coursera Project Network,Python
130,Language Classification with Naive Bayes in Python,4.5,"6,1 mil",Intermediate,Coursera Project Network,Python
131,Determine Shortest Paths Between Routers Using Python,4.6,None,Intermediate,Coursera Project Network,Python
132,Data Analysis in Python with pandas & matplotlib in Spyder,2.5,None,Beginner,Codio,Python
133,"Python Scripting: Files, Inheritance, and Databases",4.7,None,Beginner,LearnQuest,Python
134,Class Creation in Object Oriented Python,4.3,"2,7 mil",Beginner,Coursera Project Network,Python
135,Data Visualization with Python,4.5,"7,7 mil",Intermediate,Coursera Project Network,Python
136,Basic Statistics in Python (Correlations and T-tests),4.3,None,Beginner,Coursera Project Network,Python
137,Aprendiendo Python con estadística descriptiva,4.7,None,Beginner,Coursera Project Network,Python
138,Creando simulaciones con python,None,None,Intermediate,Coursera Project Network,Python
139,Image Compression and Generation using Variational Autoencoders in Python,4.7,"3,2 mil",Intermediate,Coursera Project Network,Python
140,Python for Active Defense,4.4,None,Intermediate,Infosec,Python
141,Estructuras de datos en Python,4.5,14 mil,Beginner,Universidad Austral,Python
142,Improve Your Python Code Using Amazon CodeGuru,4.6,"2,1 mil",Intermediate,Amazon Web Services,Python
143,"Reverse and complement nucleic acid sequences (DNA, RNA) using Python",4.4,None,Beginner,Coursera Project Network,Python
144,Create Python Linux Script to Generate a Disk Usage Report,4.5,"4,4 mil",Intermediate,Coursera Project Network,Python
145,Regex Python - Découvrir les Expressions Régulières,4.8,None,Beginner,Coursera Project Network,Python
146,"Classification Trees in Python, From Start To Finish",4.6,9 mil,Intermediate,Coursera Project Network,Python
147,Create a Memory Puzzle Game in Python Using Pygame,4.3,"1,7 mil",Intermediate,Coursera Project Network,Python
148,Big-O Time Complexity in Python Code,4.6,None,Intermediate,Coursera Project Network,Python
149,Análisis de datos con Python,4.6,"1,6 mil",Beginner,IBM,Python
150,Python 101: Develop Your First Python Program,4.8,"3,6 mil",Beginner,Coursera Project Network,Python
151,Create Your First Python Program From UST,4.6,30 mil,Beginner,Coursera Project Network,Python
152,An Introduction to Interactive Programming in Python (Part 2),4.9,47 mil,Beginner,Rice University,Python
153,Object-Oriented Python: Inheritance and Encapsulation,4.3,"2,1 mil",Intermediate,Codio,Python
154,Programación Orientada a Objetos con Python,4,14 mil,Beginner,Universidad Austral,Python
155,Compose and Program Music in Python using Earsketch,4.5,13 mil,Beginner,Coursera Project Network,Python
156,Manejo de bases de datos con Python,4.2,13 mil,Beginner,Universidad Austral,Python
157,用 Python 做商管程式設計（三）(Programming for Business Computing in Python (3)),4.9,"5,9 mil",Mixed,National Taiwan University,Python
158,Uso de Python para Acceder a Datos Web,None,None,Mixed,University of Michigan,Python
159,Python Basics: Selection and Iteration,4.6,"2,8 mil",Beginner,Codio,Python
160,Global Warming II: Create Your Own Models in Python,4.1,13 mil,Mixed,The University of Chicago,Python
161,Python Basics: Create a Guessing Number Game from Scratch,4.6,"3,5 mil",Beginner,Coursera Project Network,Python
162,Python Database Connection with MariaDB From Infosys,4.7,"2,2 mil",Intermediate,Coursera Project Network,Python
163,Python para a Ciência de Dados e IA,None,None,Beginner,IBM,Python
164,"Python Object Basics: Functions, Recursion, and Objects",4.8,None,Intermediate,Codio,Python
165,"Python Basic Structures: Lists, Strings, and Files",4.4,None,Beginner,Codio,Python
166,Database Operations in MariaDB Using Python From Infosys,4.6,"1,8 mil",Advanced,Coursera Project Network,Python
167,Use Python Regular Expressions to Process File Data,3.3,None,Intermediate,Coursera Project Network,Python
168,"Where, Why, and How of Lambda Functions in Python",None,None,Beginner,Coursera Project Network,Python
169,Python에서 데이터베이스 사용하기,None,None,Mixed,University of Michigan,Python
170,Dice Game in Python,4.5,None,Beginner,Coursera Project Network,Python
171,Python: обработка и анализ данных и ИИ,None,None,Beginner,IBM,Python
172,Statistical Analysis using Python Numpy,None,None,Intermediate,Coursera Project Network,Python
173,Python Dynamic HTML Web Server,4.5,6 mil,Beginner,Coursera Project Network,Python
174,Работа с базами данных в Python,None,None,Mixed,University of Michigan,Python
175,Визуализация данных с помощью Python,None,None,Intermediate,IBM,Python
176,Python Scripting for DevOps,4.3,None,Intermediate,Coursera Project Network,Python
177,"Support Vector Machines in Python, From Start to Finish",4.6,"4,6 mil",Intermediate,Coursera Project Network,Python
178,Analyze Box Office Data with Plotly and Python,4.5,"8,5 mil",Beginner,Coursera Project Network,Python
179,Snake game in Python: use Pygame to build your game,None,None,Intermediate,Coursera Project Network,Python
180,Aprendiendo Python con bases de datos,4.7,None,Beginner,Coursera Project Network,Python
181,Primeros pasos en Python,4.6,None,Beginner,Coursera Project Network,Python
182,Create Beautiful Data Visualizations with Python and Altair,None,None,Intermediate,Coursera Project Network,Python
183,Introduction to Search Techniques in Python: Binary Search,None,None,Beginner,Coursera Project Network,Python
184,Implementing Hangman Game Using Basics of Python 3,4.5,None,Beginner,Coursera Project Network,Python
185,Aprendiendo Python con álgebra lineal,4.6,None,Beginner,Coursera Project Network,Python
186,Aprendiendo Python con circuitos digitales,4.8,None,Beginner,Coursera Project Network,Python
187,Creating a Word Jumble Game in Python Using Tkinter GUI,None,None,Beginner,Coursera Project Network,Python
188,Create a Connect Four Game in Python using Pygame,None,None,Intermediate,Coursera Project Network,Python
189,Machine Learning with Python,4.7,250 mil,Intermediate,IBM,Python
190,Statistics for Data Science with Python,4.6,12 mil,Mixed,IBM,Python
191,Building Modern Python Applications on AWS,4.5,73 mil,Intermediate,Amazon Web Services,Python
192,Análise de dados com Python,None,None,Beginner,IBM,Python
193,Introdução à Ciência da Computação com Python Parte 2,4.9,25 mil,Beginner,Universidade de São Paulo,Python
194,Python Project for AI & Application Development,4.5,"7,7 mil",Intermediate,IBM,Python
195,Data Science con Python e R,4.1,None,Intermediate,Università di Napoli Federico II,Python
196,Programación para todos (Introducción a Python),4.9,"2,2 mil",Mixed,University of Michigan,Python
197,"Computers, Waves, Simulations: A Practical Introduction to Numerical Methods using Python",4.7,16 mil,Intermediate,Ludwig-Maximilians-Universität München (LMU),Python
198,Fitting Statistical Models to Data with Python,4.4,26 mil,Intermediate,University of Michigan,Python
199,Programmation pour tous (mise en route de Python),4.9,None,Mixed,University of Michigan,Python
200,Computer Vision - Image Basics with OpenCV and Python,4.3,14 mil,Beginner,Coursera Project Network,Python
201,Applied Text Mining in Python,4.2,120 mil,Intermediate,University of Michigan,Python
202,Programação para todos (Conceitos básicos de Python),5,None,Mixed,University of Michigan,Python
203,Python: Istruzioni per l’uso,4.1,None,Beginner,Università di Napoli Federico II,Python
204,Geospatial Data Visualization using Python and Folium,None,None,Intermediate,Coursera Project Network,Python
205,Use Python Unit Test to Demonstrate TDD,None,None,Intermediate,Coursera Project Network,Python
206,Python and Machine-Learning for Asset Management with Alternative Data Sets,4.4,11 mil,Intermediate,EDHEC Business School,Python
207,Applied Social Network Analysis in Python,4.7,85 mil,Intermediate,University of Michigan,Python
208,Image Processing with Python,4.3,12 mil,Intermediate,Coursera Project Network,Python
209,Traffic Sign Classification Using Deep Learning in Python/Keras,4.6,10 mil,Intermediate,Coursera Project Network,Python
210,Climate Geospatial Analysis on Python with Xarray,4.2,None,Intermediate,Coursera Project Network,Python
211,Create a Python Application using PyMongo and MongoDB Database,4.4,"3,2 mil",Intermediate,Coursera Project Network,Python
212,Network Data Science with NetworkX and Python,4.3,5 mil,Intermediate,Coursera Project Network,Python
213,Машинное обучение с использованием Python,None,None,Intermediate,IBM,Python
214,Dimensionality Reduction using an Autoencoder in Python,4.6,"3,3 mil",Intermediate,Coursera Project Network,Python
215,"Activity Recognition using Python, Tensorflow and Keras",None,None,Beginner,Coursera Project Network,Python
216,Build a Python GUI with Tkinter,4.4,"3,2 mil",Intermediate,Coursera Project Network,Python
217,Aprendizado de máquina com Python,None,None,Intermediate,IBM,Python
218,Python Data Visualization,4.7,33 mil,Beginner,Rice University,Python
219,Estadísticas para la Ciencia de Datos con Python,None,None,Mixed,IBM,Python
220,Анализ данных с использованием Python,None,None,Beginner,IBM,Python
221,Testing and Debugging Python,4.3,"6,2 mil",Intermediate,Coursera Project Network,Python
222,Use Python to Create a Web Testing Bot,4,None,Intermediate,Coursera Project Network,Python
223,Analysing Covid-19 Geospatial data with Python,4.3,None,Intermediate,Coursera Project Network,Python
224,Procesamiento del lenguaje natural con Python y Power BI,5,None,Intermediate,Coursera Project Network,Python
225,Extract Text Data with Python and Regex,4.4,None,Intermediate,Coursera Project Network,Python
226,Machine Learning for Accounting with Python,4.5,"6,6 mil",Intermediate,University of Illinois at Urbana-Champaign,Python
227,Logistic Regression with NumPy and Python,4.5,12 mil,Beginner,Coursera Project Network,Python
228,Image Segmentation with Python and Unsupervised Learning,4.6,None,Intermediate,Coursera Project Network,Python
229,Advanced Python - Reconnaissance,4,None,Mixed,Infosec,Python
230,Aprendizaje Automático con Python,5,None,Intermediate,IBM,Python
231,Python per la Data Science,None,None,Intermediate,Università di Napoli Federico II,Python
232,Visualizing & Communicating Results in Python with Jupyter,None,None,Beginner,Codio,Python
233,Linear Regression with Python,4.6,10 mil,Intermediate,Coursera Project Network,Python
234,Análisis exploratorio de datos con Python y Pandas,None,None,Beginner,Coursera Project Network,Python
235,"Storing, Retrieving, and Processing JSON data with Python",None,None,Intermediate,Coursera Project Network,Python
236,Wrangling Data for Data Analysts with Python,None,None,Beginner,Coursera Project Network,Python
237,Analyser vos données avec Python,None,None,Beginner,Coursera Project Network,Python
238,Test Driven Development Process For Beginners In Python,None,None,Beginner,Coursera Project Network,Python
239,"Where, Why, and How of List Comprehension in Python",None,None,Beginner,Coursera Project Network,Python
240,Facebook Network Analysis using Python and Networkx,4.3,None,Intermediate,Coursera Project Network,Python
241,Visualización Avanzada de datos con Python,None,None,Intermediate,Coursera Project Network,Python
242,Regresión logística con NumPy y Python,None,None,Beginner,Coursera Project Network,Python
243,Creating a Color Game in Python Using Tkinter GUI,None,None,Beginner,Coursera Project Network,Python
244,Creating a Supermarket App Using Python,4.5,None,Intermediate,Coursera Project Network,Python
245,"Python for Command-and-control, Exfiltration and Impact",5,None,Intermediate,Infosec,Python
246,DevOps and Build Automation with Python,4,None,Beginner,LearnQuest,Python
247,Detect Fake News in Python with Tensorflow,3.8,None,Intermediate,Coursera Project Network,Python
248,COVID-19 : Les séries temporelles avec Python et Pandas,4.5,None,Intermediate,Coursera Project Network,Python
249,Working with AWS S3 Buckets using Python & boto3,5,None,Beginner,Coursera Project Network,Python
250,Introduction to Statistics in Python,None,None,Intermediate,Coursera Project Network,Python
251,DataViz - Grammaire des Graphiques avec Python,None,None,Intermediate,Coursera Project Network,Python
252,Text Generation with Markov Chains in Python,None,None,Intermediate,Coursera Project Network,Python
253,AWS Elastic Beanstalk:Deploy a Python(Flask) Web Application,4.6,"1,5 mil",Beginner,Coursera Project Network,Python
254,Regular Expressions in Python,4.3,None,Intermediate,Coursera Project Network,Python
255,Configuring Python Extension Pack with Visual Studio Code,None,None,Beginner,Coursera Project Network,Python
256,Build a User Interface using Python Language,None,None,Intermediate,Coursera Project Network,Python
257,Visualización de Datos con Python,4.6,None,Intermediate,IBM,Python
258,Hypothesis Testing with Python and Excel,4.2,"2,1 mil",Intermediate,Tufts University,Python
259,Use Python and Java to Create a GUI Application,None,None,Intermediate,Coursera Project Network,Python
260,Программирование для всех (начало работы с Python),None,None,Mixed,University of Michigan,Python
261,Create your own Sudoku Solver using AI and Python,4.3,"2,7 mil",Intermediate,Coursera Project Network,Python
262,Create a Tic-Tac-Toe game in Python,4.9,None,Intermediate,Coursera Project Network,Python
263,Practical Python for AI Coding 2,None,None,Beginner,Korea Advanced Institute of Science and Technology(KAIST),Python
